<?xml version="1.0" encoding="ISO-8859-1"?>
<Server xsi:noNamespaceSchemaLocation="server.xsd"
    url="http://www.tematika.com" modoAplicacionHabilitado="false"
    dominioSitio="www.tematika.com" dominioIntranet="" xmlns:xsi="http://www.w3.org/2001/XMLSchema-instance">
    <Aplicacion>sitio</Aplicacion>
    <Log>alto</Log>
    <Modo>release</Modo>
    <Mailing habilitado="true" mailer="server@tematika.com"
        smtpHost="172.29.0.20"
        webmasterMail="clopez@ilhsa.com"
        serverMail="http://172.29.0.20" mailLargos="true"/>
    <Control habilitado="true" iteraciones="2" memoriaAlerta="45000"
        memoriaMaxima="1040000" consola="taskkill /F /IM jrun.exe"/>
    <ProgramaExtra habilitado="true"/>
    <GPay host="172.29.0.10" port="20001" comercio="tematikasite"
        mensaje="COMPRA EN TEMATIKA" baseTerminal="tematika-"
        tiempoEsperaMaxima="60" cantidadDeTerminales="7" habilitaCuotas="true">
        <Errores mensajePorDefecto="Su operación ha fallado por un problema de comunicación. Por favor, intente nuevamente más tarde y disculpe las molestias ocasionadas.">
            <Error codigo="0" mensajeAMostrar="Su operación ha fallado por un problema de comunicación. Por favor, intente nuevamente más tarde y disculpe las molestias ocasionadas."/>
            <Error codigo="1" mensajeAMostrar="La operación no ha sido aprobada ya que ha ingresado algún dato de su tarjeta en forma errónea. Por favor, verifique la fecha de vencimiento y el código de seguridad y vuelva a intentar el pago."/>
            <Error codigo="2" mensajeAMostrar="La operación no ha sido aprobada ya que ha ingresado algún dato de su tarjeta en forma errónea. Por favor, verifique la fecha de vencimiento y el código de seguridad y vuelva a intentar el pago."/>
            <Error codigo="4" mensajeAMostrar="Su tarjeta se encuentra inhabilitada para generar compras. Le pedimos por favor se contacte con el Banco o Entidad emisora de la misma para regularizar la situación."/>
            <Error codigo="5" mensajeAMostrar="Su tarjeta se encuentra inhabilitada para generar compras. Le pedimos por favor se contacte con el Banco o Entidad emisora de la misma para regularizar la situación."/>
            <Error codigo="7" mensajeAMostrar="Su tarjeta se encuentra inhabilitada para generar compras. Le pedimos por favor se contacte con el Banco o Entidad emisora de la misma para regularizar la situación."/>
            <Error codigo="12" mensajeAMostrar="Por favor, verifique que todos los datos ingresados sean correctos e intente nuevamente la operación. Tenga en cuenta que las tarjetas de débito no se encuentran habilitadas en nuestro sistema para realizar compras y que solamente podrá operar en cuotas en caso de utilizar una tarjeta de procedencia Argentina."/>
            <Error codigo="14" mensajeAMostrar="Por favor, verifique que todos los datos ingresados sean correctos e intente nuevamente la operación. Tenga en cuenta que las tarjetas de débito no se encuentran habilitadas en nuestro sistema para realizar compras."/>
            <Error codigo="25" mensajeAMostrar="La operación no ha sido aprobada ya que ha ingresado algún dato de su tarjeta en forma errónea. Por favor, verifique la fecha de vencimiento y el código de seguridad y vuelva a intentar el pago."/>
            <Error codigo="30" mensajeAMostrar="Por favor, verifique que todos los datos ingresados sean correctos e intente nuevamente la operación. Tenga en cuenta que las tarjetas de débito no se encuentran habilitadas en nuestro sistema para realizar compras."/>
            <Error codigo="43" mensajeAMostrar="Su tarjeta se encuentra inhabilitada para generar compras. Le pedimos por favor se contacte con el Banco o Entidad emisora de la misma para regularizar la situación."/>
            <Error codigo="45" mensajeAMostrar="Su tarjeta se encuentra inhabilitada para generar compras en cuotas en nuestro site. Le pedimos por favor realice el pedido a través del pago en una única cuota. Muchas gracias."/>
            <Error codigo="48" mensajeAMostrar="Su tarjeta se encuentra inhabilitada para generar compras en cuotas en nuestro site. Le pedimos por favor realice el pedido a través del pago en una única cuota. Muchas gracias."/>
            <Error codigo="50" mensajeAMostrar="Su tarjeta se encuentra inhabilitada para generar compras ya que no posee los fondos suficientes para realizar esta operación."/>
            <Error codigo="51" mensajeAMostrar="Su tarjeta se encuentra inhabilitada para generar compras ya que no posee los fondos suficientes para realizar esta operación."/>
            <Error codigo="53" mensajeAMostrar="La operación no ha sido aprobada ya que ha ingresado algún dato de su tarjeta en forma errónea. Por favor, verifique los datos ingresados y vuelva a intentar el pago."/>
            <Error codigo="54" mensajeAMostrar="Su tarjeta se encuentra inhabilitada para generar compras ya que la misma se encuentra vencida. Verifique los datos ingresados y en caso de ser correctos comuníquese con el Banco o Entidad emisora de la misma para regularizar la situación."/>
            <Error codigo="57" mensajeAMostrar="Por favor, verifique que todos los datos ingresados sean correctos e intente nuevamente la operación. Tenga en cuenta que las tarjetas de débito no se encuentran habilitadas en nuestro sistema para realizar compras."/>
            <Error codigo="77" mensajeAMostrar="Por favor, verifique que todos los datos ingresados sean correctos e intente  nuevamente la operación. Tenga en cuenta que las tarjetas de débito no se encuentran habilitadas en nuestro sistema para realizar compras y que solamente podrá operar en cuotas en caso de utilizar una tarjeta de procedencia Argentina."/>
            <Error codigo="94" mensajeAMostrar="Su compra se encuentra en proceso de aprobación y será contactado por nuestro personal de Atención al Cliente para verificar sus datos. El contacto se realizará a la mayor brevedad posible vía mail o telefónicamente al número ingresado en el pedido. Le recordamos que nuestro horario de atención es de Lunes a Viernes de 9 a 20hs. Muchas Gracias.">
                <Email>rmiranda@ilhsa.com</Email>
                <Email>clopez@ilhsa.com</Email>
            </Error>
            <Error codigo="96" mensajeAMostrar="Su operación ha fallado por un problema de comunicación. Por favor, intente nuevamente más tarde y disculpe las molestias ocasionadas."/>
            <Error codigo="110">
                <Email>apaz@ilhsa.com</Email>
                <Email>clopez@ilhsa.com</Email>
                <Email>sistemassoporte@ilhsa.com</Email>
                <Email>ffulleringer@ilhsa.com</Email>
                <Email>cdiaz@ilhsa.com</Email>
                <Email>slaguna@ilhsa.com</Email>
                <Email>jpiermattei@ilhsa.com</Email>
                <Email>aandreoli@ilhsa.com</Email>                
            </Error>
            <Error codigo="111">
                <Email>apaz@ilhsa.com</Email>
                <Email>clopez@ilhsa.com</Email>
                <Email>sistemassoporte@ilhsa.com</Email>
                <Email>ffulleringer@ilhsa.com</Email>
                <Email>cdiaz@ilhsa.com</Email>
                <Email>slaguna@ilhsa.com</Email>
                <Email>jpiermattei@ilhsa.com</Email>
                <Email>aandreoli@ilhsa.com</Email>        
            </Error>
            <Error codigo="120">
                <Email>apaz@ilhsa.com</Email>
                <Email>clopez@ilhsa.com</Email>
                <Email>sistemassoporte@ilhsa.com</Email>
                <Email>ffulleringer@ilhsa.com</Email>
                <Email>cdiaz@ilhsa.com</Email>
                <Email>slaguna@ilhsa.com</Email>
                <Email>jpiermattei@ilhsa.com</Email>
                <Email>aandreoli@ilhsa.com</Email>        
            </Error>
            <Error codigo="121">
                <Email>apaz@ilhsa.com</Email>
                <Email>clopez@ilhsa.com</Email>
                <Email>sistemassoporte@ilhsa.com</Email>
                <Email>ffulleringer@ilhsa.com</Email>
                <Email>cdiaz@ilhsa.com</Email>
                <Email>slaguna@ilhsa.com</Email>
                <Email>jpiermattei@ilhsa.com</Email>
                <Email>aandreoli@ilhsa.com</Email>        
            </Error>
            <Error codigo="130">
                <Email>apaz@ilhsa.com</Email>
                <Email>clopez@ilhsa.com</Email>
                <Email>sistemassoporte@ilhsa.com</Email>
                <Email>ffulleringer@ilhsa.com</Email>
                <Email>cdiaz@ilhsa.com</Email>
                <Email>slaguna@ilhsa.com</Email>
                <Email>jpiermattei@ilhsa.com</Email>
                <Email>aandreoli@ilhsa.com</Email>        
            </Error>
            <Error codigo="131">
                <Email>apaz@ilhsa.com</Email>
                <Email>clopez@ilhsa.com</Email>
                <Email>sistemassoporte@ilhsa.com</Email>
                <Email>ffulleringer@ilhsa.com</Email>
                <Email>cdiaz@ilhsa.com</Email>
                <Email>slaguna@ilhsa.com</Email>
                <Email>jpiermattei@ilhsa.com</Email>
                <Email>aandreoli@ilhsa.com</Email>        
            </Error>
            <Error codigo="141">
                <Email>apaz@ilhsa.com</Email>
                <Email>clopez@ilhsa.com</Email>
                <Email>sistemassoporte@ilhsa.com</Email>
                <Email>ffulleringer@ilhsa.com</Email>
                <Email>cdiaz@ilhsa.com</Email>
                <Email>slaguna@ilhsa.com</Email>
                <Email>jpiermattei@ilhsa.com</Email>
                <Email>aandreoli@ilhsa.com</Email>        
            </Error>